<?xml version='1.0' encoding='UTF-8'?>
<!DOCTYPE city_report SYSTEM "city_report.dtd">
<city_report appeal_score="52.5">
  <metadata>
    <title>Brussels</title>
    <name_it>Bruxelles</name_it>
    <flag>🇧🇪</flag>
  </metadata>
  <indicators>
    <hotel_count>9</hotel_count>
    <hotel_price>143.38</hotel_price>
    <safety index_score="50.1"/>
    <environment green_score="70"/>
    <cost_index value="77.5"/>
    <economic_accessibility score="22.5"/>
  </indicators>
  <transport>I tram sono il mezzo più rapido per spostarsi da un punto all'altro della città. È possibile utilizzare autobus e tram con lo stesso biglietto entro un'ora.</transport>
  <accommodation>
    <hotel>
      <name>2Go4 Hostel</name>
      <price>€20+</price>
    </hotel>
    <hotel>
      <name>Hostel Jacques Brel</name>
      <price>Prezzo N/D</price>
    </hotel>
    <hotel>
      <name>Citadines Sainte-Catherine Brussels</name>
      <price>Prezzo N/D</price>
    </hotel>
    <hotel>
      <name>Hotel Cafe Pacific</name>
      <price>€120+</price>
    </hotel>
    <hotel>
      <name>Hotel NH Collection Brussels Centre</name>
      <price>from €99</price>
    </hotel>
  </accommodation>
  <highlights>
    <attraction lat="50.8467" lon="4.3524">
      <name>Grand Place</name>
      <description>Central square known for its ornate guildhouses.</description>
    </attraction>
    <attraction lat="50.8949" lon="4.3415">
      <name>Atomium</name>
      <description>Futuristic structure representing an iron crystal.</description>
    </attraction>
    <attraction lat="50.845" lon="4.35">
      <name>Manneken Pis</name>
      <description>Famous small bronze statue of a boy urinating.</description>
    </attraction>
    <attraction lat="50.8417" lon="4.3622">
      <name>Royal Palace</name>
      <description>The official residence of the Belgian monarchs.</description>
    </attraction>
    <attraction lat="50.84" lon="4.3917">
      <name>Cinquantenaire</name>
      <description>Park featuring a triumphal arch and museums.</description>
    </attraction>
    <attraction lat="50.894" lon="4.339">
      <name>Mini-Europe</name>
      <description>Park with miniature models of European landmarks.</description>
    </attraction>
    <attraction lat="50.8511" lon="4.3601">
      <name>Comic Strip Center</name>
      <description>Museum dedicated to the history of Belgian comics.</description>
    </attraction>
    <attraction lat="50.8422" lon="4.3586">
      <name>Magritte Museum</name>
      <description>Museum dedicated to the surrealist artist René Magritte.</description>
    </attraction>
    <attraction lat="50.8439" lon="4.3567">
      <name>Mont des Arts</name>
      <description>Historic site with gardens and a panoramic city view.</description>
    </attraction>
    <attraction lat="50.8478" lon="4.3601">
      <name>St. Michael Cathedral</name>
      <description>Gothic church located on the Treurenberg hill.</description>
    </attraction>
  </highlights>
  <districts>
    <district>
      <name>Pentagon</name>
      <description>The Pentagon (French: Le Pentagone, Dutch: Vijfhoek) is the historical center of Brussels. It derives its name from the pentagonal shape of the inner beltway that surrounds the area. The Pentagon of Brussels encompasses many charming and beautiful attractions, with deeply ornate buildings on the Grand-Place/Grote Markt, and a fish-and-crustacean overdose of St. Catherine's Square (Place...</description>
    </district>
    <district>
      <name>European Quarter</name>
      <description>The European Quarter (French: Quartier européen, Dutch: Europese wijk) in Brussels, Belgium is a large office area east of the center which is mostly taken up by the European Union. The district also houses the large Parc de Cinquantenaire and a beautiful, but expensive, residential area on its northern edge. Metro line 5 goes straight through the district, and 6 also traverses the western edge....</description>
    </district>
    <district>
      <name>West</name>
      <description>The West contains the extensive western suburbs of Brussels. Except for the Sacred Heart basilica, tourists usually do not visit this part of the city.  ]]
* 
* 
* 
*  *  * Football: RSC Anderlecht play soccer in First Division A, the country's top tier. Their home ground is Lotto Park, capacity 22,500. 
*  *</description>
    </district>
    <district>
      <name>South</name>
      <description>The South district in the Belgian capital of Brussels comprises the municipalities of Saint-Gilles / Sint-Gillis, Forest / Vorst and Uccle / Ukkel. Forest (pronounced with a silent "st") is the French name of one of the municipalities surrounding Brussels (the Flemish name is Vorst), known for its historically important abbey, a collection of art deco buildings and a major concert hall. Green and...</description>
    </district>
    <district>
      <name>Centre</name>
      <description>The Centre is the historic centre of Brussels, including the world's most beautiful town square, the Grand-Place which is listed as .  is on the eastern end of the city centre. It is a terminus station for most regional (suburban) services and many other intercity services (including from the Netherlands) stop by. The city centre has two metro stations, both on lines 1/5 (both metro lines share...</description>
    </district>
  </districts>
  <description>Cuore politico dell'Unione Europea, Bruxelles gestisce una complessità demografica unica con politiche di inclusione avanzate. Il suo profilo è definito da un'offerta alberghiera di alto profilo e una rete di trasporti capillare.</description>
  <wiki_intro>The Pentagon (French: Le Pentagone, Dutch: Vijfhoek) is the historical center of Brussels. It derives its name from the pentagonal shape of the inner beltway that surrounds the area. The Pentagon of Brussels encompasses many charming and beautiful attractions, with deeply ornate buildings on the Grand-Place/Grote Markt, and a fish-and-crustacean overdose of St. Catherine's Square (Place...</wiki_intro>
  <landmark_image>https://commons.wikimedia.org/wiki/Special:FilePath/Grand-Place_bruxelles.jpg</landmark_image>
</city_report>
