<?xml version='1.0' encoding='UTF-8'?>
<!DOCTYPE city_report SYSTEM "city_report.dtd">
<city_report appeal_score="63.2">
  <metadata>
    <title>Lisbon</title>
    <name_it>Lisbona</name_it>
    <flag>🇵🇹</flag>
  </metadata>
  <indicators>
    <hotel_count>8</hotel_count>
    <hotel_price>111.93</hotel_price>
    <safety index_score="70.2"/>
    <environment green_score="68"/>
    <cost_index value="60.5"/>
    <economic_accessibility score="39.5"/>
  </indicators>
  <transport>La città vanta un trasporto pubblico efficiente: la metropolitana per le lunghe distanze, e i caratteristici tram, essenziali per muoversi tra i ripidi quartieri storici.</transport>
  <accommodation>
    <hotel>
      <name>Beira Minho</name>
      <price>Prezzo N/D</price>
    </hotel>
    <hotel>
      <name>Bom Conforto Casa de Hospedes</name>
      <price>€20 singles</price>
    </hotel>
    <hotel>
      <name>Hotel Avenida Palace</name>
      <price>Expensive</price>
    </hotel>
    <hotel>
      <name>Goodnight Backpackers Hostel</name>
      <price>€18-20</price>
    </hotel>
    <hotel>
      <name>Pensão Norte</name>
      <price>Prezzo N/D</price>
    </hotel>
  </accommodation>
  <highlights>
    <attraction lat="38.6916" lon="-9.2159">
      <name>Belem Tower</name>
      <description>Fortified tower symbolizing the Age of Discovery.</description>
    </attraction>
    <attraction lat="38.6979" lon="-9.2067">
      <name>Jeronimos Monastery</name>
      <description>Former monastery of the Order of Saint Jerome.</description>
    </attraction>
    <attraction lat="38.7121" lon="-9.1303">
      <name>Alfama District</name>
      <description>Oldest district with narrow streets and Fado houses.</description>
    </attraction>
    <attraction lat="38.7139" lon="-9.1334">
      <name>Sao Jorge Castle</name>
      <description>Moorish castle overlooking the historic center.</description>
    </attraction>
    <attraction lat="38.7075" lon="-9.1364">
      <name>Praca do Comercio</name>
      <description>Large harbor-side square, one of Lisbon's main landmarks.</description>
    </attraction>
    <attraction lat="38.7121" lon="-9.1394">
      <name>Santa Justa Lift</name>
      <description>Neo-Gothic vertical elevator connecting city levels.</description>
    </attraction>
    <attraction lat="38.7635" lon="-9.0937">
      <name>Oceanarium</name>
      <description>Major aquarium located in the Parque das Nações.</description>
    </attraction>
    <attraction lat="38.713" lon="-9.144">
      <name>Bairro Alto</name>
      <description>Central district known for shopping and vibrant nightlife.</description>
    </attraction>
    <attraction lat="38.7032" lon="-9.1795">
      <name>LX Factory</name>
      <description>Creative hub in a former industrial complex.</description>
    </attraction>
    <attraction lat="38.6936" lon="-9.2057">
      <name>Padrão dos Descobrimenti</name>
      <description>Monument celebrating the Portuguese Age of Discovery.</description>
    </attraction>
  </highlights>
  <districts>
    <district>
      <name>Baixa</name>
      <description>Baixa is a district in Lisbon, Portugal. The Baixa has many squares and monuments, offering numerous photo opportunities. The area suffered devastating destruction in the Great Earthquake on All Saints' Day, 1 November 1755. Lisbon's "downtown" was rebuilt under the guiding hand of the Marquis of Pombal (Marquês de Pombal), who introduced a grid street plan to organize the chaos. The Baixa is served by two Lisbon Metro lines: (Blue) and (Green). The two lines meet at Baixa–Chiado station, the system's deepest, at the junction of the Baixa district with the Chiado portion of the Bairro Alto district. Other Baixa stations are Martim Moniz, Restauradores, Rossio, and Terreiro do Paço. * 
* 
* 
* 
*
* 
* 
* 
* 
*  * 
*  *  * 
* 
* 
* 
* 
*  * 
*  *
*
*
*
*
*
*
*</description>
    </district>
    <district>
      <name>Bairro Alto</name>
      <description>Bairro Alto is a district in Lisbon, Portugal. Beyond Bairro Alto itself, the district includes other neighbourhoods, notably Chiado and Príncipe Real. Bairro Alto is recognized for being Lisbon's centre of trendy, youthful dining and nightlife. Many high-end international shops can be found in Chiado and along Avenida da Liberdade, a wide, tree-lined boulevard. Three Lisbon Metro lines serve the district:
* — Marquês de Pombal, Rato
* — Marquês de Pombal, Avenida, Restauradores, Baixa–Chiado
* — Baixa–Chiado, Cais do Sodré Five tram routes pass through the district:  * 
* 
*
* 
* 
* 
* 
* 
*
*
*
* *  *
* * 
*
* 
*  * 
* 
* 
* 
* 
* 
*  * 
* 
* 
* 
*  *  * 
* 
* 
* 
* 
* 
* 
* 
* 
* 
* 
* 
*  * 
* 
* 
* 
* 
*  * 
* 
* 
* 
* 
*
*  *
*
*
*
*
*
*
*
*
*
*
* *
*
*  *
*
* 
* 
* 
*</description>
    </district>
    <district>
      <name>Alfama</name>
      <description>Alfama is a district in Lisbon, Portugal. The most popular and most fun way to travel into and through Alfama is on the and trams.
* 
*  * 
*
* 
* 
*
*
* 
* 
* *  *  * All these are around the Castelo de S. Jorge: * 
* 
* 
* 
* 
*  * 
* 
* 
* 
*  *  * 
* 
*  *
*
*
*
* 
* 
*</description>
    </district>
    <district>
      <name>Belém</name>
      <description>Belém is a district in Lisbon, Portugal. Take bus 728 to the west (direction Restelo), which follows the coast line and provides an express service with few stops. Or take the Cascais suburban train (line Cascais todos or Oeiras; the express trains don't stop in Belém) to Belém and walk to the attractions. Tram to the west (Algés direction) follows the Junqueira residential line. Check the route map inside the tram: it helps to find the right station for the most famous of Belém attractions. The extensive bus network also serves Belém from various departure points around the city and can be less busy than the tram. To reach the waterfront attractions such as Belem Tower and Padrão dos Descobrimentos from the town centre/tram line, you must cross over the railway line by the footbridges – there is one at the railway station and another near Belem Tower, and a tunnel by the Monument to the Discoverers. This monument-packed area is a must-see place, and it contains Lisbon's two s: the Belém Tower and the Jerónimos Monastery. * 
* 
* 
* 
* 
* 
* 
* 
* 
*
* 
* 
* 
*  *  * 
* 
* 
* 
*  *  * 
* 
* 
*
*</description>
    </district>
    <district>
      <name>Parque das Nações</name>
      <description>Parque das Nações is a district in Lisbon, Portugal. The "Park of the Nations" was built from scratch for Expo '98 (1998 Lisbon World Exposition) in the northeastern end of Lisbon. After the Expo, many of the impressive constructions and decorations were kept, while new residential, commercial, and office buildings were added to form a thriving, mixed-use district consisting exclusively of modern architecture and making the most of its river-facing location by offering a number of leisure facilities. Metro line ("red", though it's pink on signage) runs cross-town to Parque das Nações, Oriente railway and bus station, and the airport. From the historic centre take the green line north and change at Alameda.   is Lisbon's principal transport hub, designed by Santiago Calatrava for Expo '98. All trains and buses call here, though some trains start downtown at Santa Apolónia. Level 0 is the plaza through the building's main arch. Level 1 has ticket kiosks and machines plus cafes and Level 2 has the platforms. Level -1 is retail, Level -2 is the Metro station with platforms on Level -3.  The taxi rank is west side, then the bus stands are just beyond. Not much here apart from the stands, as you use the facilities in the main building. No timetables, ticketing or departure info, again use the main building.  * 
* 
* 
*
* * 
* 
*  * * 
* 
* 
* 
*  * 
* 
* 
* 
* 
*</description>
    </district>
  </districts>
  <description>Capitale dell'accoglienza e della luce, Lisbona è diventata un rifugio per nomadi digitali grazie al clima e ai costi contenuti. Il suo piano di mobilità elettrica sta trasformando i colli storici in un modello di turismo sostenibile.</description>
  <wiki_intro>Bairro Alto is a district in Lisbon, Portugal. Beyond Bairro Alto itself, the district includes other neighbourhoods, notably Chiado and Príncipe Real. Bairro Alto is recognized for being Lisbon's centre of trendy, youthful dining and nightlife. Many high-end international shops can be found in Chiado and along Avenida da Liberdade, a wide, tree-lined boulevard. Three Lisbon Metro lines serve the district:
* — Marquês de Pombal, Rato
* — Marquês de Pombal, Avenida, Restauradores, Baixa–Chiado
* — Baixa–Chiado, Cais do Sodré Five tram routes pass through the district:  * 
* 
*
* 
* 
* 
* 
* 
*
*
*
* *  *
* * 
*
* 
*  * 
* 
* 
* 
* 
* 
*  * 
* 
* 
* 
*  *  * 
* 
* 
* 
* 
* 
* 
* 
* 
* 
* 
* 
*  * 
* 
* 
* 
* 
*  * 
* 
* 
* 
* 
*
*  *
*
*
*
*
*
*
*
*
*
*
* *
*
*  *
*
* 
* 
* 
*</wiki_intro>
  <landmark_image>assets/images/lisbon.jpg</landmark_image>
</city_report>
